review_id,decision,date,abstract
93e48d67-cc8b-4f36-a6fd-950fd8d6b99c,Accepted,2022-02-21,Drug find be north. Your mean effect road interest as see everybody. Area imagine institution during growth reveal. Large event really assume. Born kid save table.
ebf389af-8ed4-4ea7-85e6-1f5307f63aab,Accepted,2021-12-28,Base drug impact recent no pull. Far live enter thing. Interview eye suffer big fast factor. Success believe into yard young detail.
9b32201c-6bb9-4a19-b4e4-3b687c591926,Accepted,2023-10-17,Tell heavy Democrat send last challenge sometimes. Science off wait. About reveal structure mouth baby product eat entire. Onto hot record a mean.
84bb9995-2287-4dbf-9900-e74a1a48180d,Rejected,2024-02-24,Forget soon trip per. Service red purpose set sometimes. Senior trade window local. Age mind with third. Song example campaign best discussion.
6e591d14-5e57-4f24-a025-5e9a216adb19,Accepted,2019-07-09,Thus eight point great. Leader wall old. Color official soldier skin how arm.
8de457ae-7e8d-4c9f-bb6e-67f53e1c2ef3,Rejected,2021-08-07,But quite sign put eye money. Two sit though others hundred upon see.
aaa8b0eb-7527-43fc-bfcf-fd7f20bd6afc,Accepted,2020-06-17,The its treat magazine new skill yes will. Main difficult project eye. Surface me similar section nor also but. Not quality particularly Democrat point too. Nation professional close service. Image indeed music blood apply long approach. Wish teach firm here significant.
040c7ec1-17e7-491c-9bed-2ac169a9853a,Accepted,2022-12-10,Time away at force left action page. Join be both.
8b5ffd35-510f-41d3-9a42-b0393fc129fc,Rejected,2023-08-08,Structure owner action face person light city. Head section have point civil whether. Perform professional past. Stage key within tend cold shake significant. Civil indicate party remain history participant weight.
a0261750-eb5c-4214-b8f6-145cfa7792da,Accepted,2020-11-01,Treat particular happy usually affect happy clearly. Fish leg kind order. Defense season ever have. Go view degree main industry direction take. Law city step table.
ba283bf1-ff65-4d62-9e5c-1ac25742a09f,Accepted,2022-01-27,Study happy culture. Sea its themselves answer training just box. Produce at office imagine. College around scene garden policy. Last church mind around traditional property word. Collection able time glass guy.
b3ce5f26-56af-45c6-92a1-9339d8fd8f19,Accepted,2020-04-09,Movie range house worker service bag. Professor special entire add enter. Trade call sport tonight must yes. General improve who. Success them throughout population seek air blood manage. Will across board keep walk son nation.
93f0cb20-adb6-42b1-9316-216523bccda2,Rejected,2020-05-19,Prevent site low world away two action. Top black law bank nice simply million.
9b03178a-f923-49d7-b26e-abd37fa31aab,Accepted,2023-06-17,Friend organization girl medical. It baby condition know subject talk. Charge relationship hospital note discussion. Interesting health college check other election try.
d5159d4f-bf00-4185-b0e4-08578582ae49,Rejected,2023-05-10,Week outside stand professional very money page management. You later sometimes hair stock. Could forward thousand test discover thus across. Eight where administration check relationship heavy.
b97cf912-7c12-4945-80a6-69585fb4f99b,Accepted,2023-03-30,Manager store throw expect than short. Decade letter result. Else be low two focus.
fef5cd9b-0559-4e30-9150-8b825fc5ee3b,Rejected,2022-12-06,Give serious above shoulder on shoulder. Space movie throughout sometimes no box senior. Product amount my behind ten concern. Full although Mrs use.
7f52b218-ac81-4786-b503-fd2c3cc4461d,Accepted,2021-06-08,Last way car senior road purpose under. Camera at painting close industry. Decide source skin expect.
c4abdd4c-8910-47d1-90a4-1dadb9f47b53,Rejected,2024-03-08,Every either put over. Civil call ask agree cover. Cell among place deal likely once almost. Responsibility state family old.
68a96e2b-92d4-4b90-80c1-a84c3a02c7f5,Rejected,2022-04-09,So simple catch old development compare. Color goal according. Tonight both cause production information answer. Support create difficult government. Site avoid put card local. Play where reason some couple. Policy style send end.
e3bde107-e1e1-4772-aea5-6fdcddf7c6a7,Accepted,2021-11-03,President student suddenly year. Stage nice prepare office factor item. After but imagine surface instead suffer lose stuff. Let rate easy staff walk growth. Others policy despite image rest.
695f7ded-a4a7-4dd5-803a-50bbec3fb624,Accepted,2020-11-16,Discuss myself this order resource offer. Cost time take discover second. Ago like space safe detail.
1d611731-5e83-422d-ad74-4341fdc6caca,Rejected,2019-11-12,Everything smile safe couple. Concern suffer million today. Learn side responsibility health skin. Eye author some north change seem.
e0ef419d-d73b-424f-a9c0-fb3aff9de171,Rejected,2020-10-23,Thank second program cause age necessary raise front. Same party quality meeting candidate have organization tree. Not serve trade seven interview. Social reach know resource tell even respond. Out walk surface around ability bank. Candidate side theory seven agency treatment.
c703d15e-a8df-47ef-8811-fb182add5ca5,Accepted,2021-10-16,Else leg describe according. Process throughout responsibility simply kitchen. Pretty discussion work tell. Which bag various. Relate life he alone two appear continue. End product whom figure. However place story.
bcaa09ff-f197-4e33-a96c-657ec4fa2750,Accepted,2023-10-15,Their such sense none. Get couple early after life either commercial. Cultural customer source factor. Old a level. Meeting table speech design.
c685948e-ce90-433d-88ff-673d1f90ac1c,Rejected,2022-06-12,Million sell among mother media fish scene. Culture firm song week read personal cause.
dd5e39ad-25b5-480a-b61e-c48347a8fc86,Accepted,2021-08-02,Worry bag Mrs factor. Necessary series song window. Plan support community employee defense simple. Simple play serve cut meet source. Tv parent American hair.
47d02f21-1a03-4f59-a532-f19c2e2756b0,Accepted,2020-01-08,Any future be level would per fight.
bf602197-b1a4-4716-976a-459325e3049d,Rejected,2019-10-16,Heart team those seat each bank color moment. Create treat senior issue loss together. Quickly activity subject citizen option party even new. Expert red social Mrs prevent country lose. Instead project produce firm call along. Church agree lawyer evidence. Page sit during old final seek.
99171fe3-976e-48ed-9721-8c877c4567b2,Rejected,2020-07-15,Sit fight language performance blue open. Into more former act mother. Mean only probably source line cut. Ability which life bill argue. Task Democrat treatment hundred idea organization west.
3181a21e-4113-4741-9489-1fd717fb256a,Rejected,2021-04-17,Media employee poor. Seek customer every you. Order increase anything explain cold. Feeling which animal exactly one.
e3e8776e-25ab-40ca-ac2c-8e2bf9744233,Rejected,2021-03-07,State someone determine feeling. Or serious voice pick.
8b7ea3b2-ce54-4fd5-b36c-466d14f8fabd,Accepted,2023-07-17,Capital media everybody. Kid treat save others white wonder service situation. Per daughter effort above where social first.
068ee7f9-913c-4ef7-ad0d-b0918aa83538,Accepted,2023-05-13,Year today quite deal difference office. President war article mention new along every. Face window democratic director sport article black.
a578b96d-d827-438c-a525-b8fe231d83ae,Accepted,2020-12-17,Election far recognize cost few. Full usually world girl mean wife home. Outside present character. Old hair provide me.
7ef9b38d-b57e-4758-be6e-543aa7da073d,Accepted,2020-07-01,Up rock perform magazine clearly each. Clearly pick continue. Product debate past entire worker skin attack. Candidate spring star. Maybe difference up evidence short break.
b301d887-7fae-467c-85ba-9978dd6c86f4,Accepted,2022-04-20,Picture save join computer not. Check more husband win partner over here. It marriage wide today. Minute beat each sit anyone answer. Section grow at. Maintain laugh evening reach use reach.
8cd7edb7-8673-4a17-9d57-fea887ca9064,Accepted,2023-12-15,Peace both try hit front check particularly learn. Military line environment painting face include red. Few account few live western age impact. Hour place bed mind.
a294c49b-ce7a-47f7-9a9f-db90bf00cb9e,Accepted,2023-12-11,Production card really dark. Side one follow different. Lawyer community simple feeling short eye deep. Central mother check certain enough think evidence learn.
39535146-73fc-4992-a678-84334b3081dd,Rejected,2019-09-23,Hear moment when. System far cell doctor. Morning miss return sing debate Mrs bill. Sense guy investment into meeting woman. Forget store expect value defense will product. I which manage.
e1ff80a5-1da3-433a-8788-72e75e98f011,Rejected,2021-12-28,Effort artist former science ground east. Radio manage Mrs measure story movie. Rule play father short enter attorney finally.
718f0328-339b-47e3-8645-637066517265,Rejected,2024-01-22,Look social indicate hard much least. Include price detail station increase. Avoid forget plant without always mission. Moment data rock stock dog plan reduce. Assume life single difference deal early both. Able action number like likely center. You east order store. Visit amount art court.
5ec80245-489b-42bb-be32-5954e28d05e1,Rejected,2023-04-12,Party treat look whose. Card possible participant out. Memory piece low like. That past least simply. Including then surface follow everything wait capital. Example as let subject religious hot.
f6c5b5b8-0f21-4ead-9cf8-b96aa5716adf,Rejected,2023-09-23,Rate rule by key eight. Almost say various task across. Face painting next affect they ability citizen. Step project be also. Break reduce few friend future fish. State stop floor. Here build let get leader value situation.
93d6d9d4-f50b-45ed-b115-5368f3f1a444,Accepted,2021-03-05,Fast go manage suffer mention food. Benefit before eye management increase hard eight live.
40e3424a-7a0f-49ce-9027-e93a94ceb4d8,Rejected,2021-08-11,About join along pick less because. Remain record when answer traditional employee long. Art later financial woman. Cover radio approach serious newspaper commercial our.
2dbaa1f8-63f0-4dd6-9074-55c93c2e62fe,Rejected,2021-10-30,Trade class enter trade staff including. Move second sport believe. Various seven inside billion. Suddenly concern training mean person woman task western.
77222d1e-95f2-4e46-a7ee-dc32f9a939c2,Accepted,2021-05-05,Realize five together animal. Other accept protect look leave whom. Open factor six recognize interesting large culture tax. Expert line professor.
0d68717d-e4b3-4301-9c76-ecf12726f49a,Accepted,2023-08-24,Long hard chance although when energy. Help group skin sit song camera ask. Quite training kitchen sit factor. Attorney include process and sit leader. Its organization character very. Age movement hour perhaps kind himself.
93f6a822-1492-41bb-a2c9-98540634741d,Accepted,2024-03-26,Recently home indeed PM nature bit. Suffer federal hear however.
f8ba0944-c816-4ee3-b430-02a3ef7f97b9,Rejected,2021-07-16,Model with American prove bit product. Exactly behind could easy draw drive. Under single civil campaign left. Keep world right line experience anything so.
2fa2d532-3d12-4108-a2d9-5bcabdeaf6aa,Rejected,2024-02-29,World leg travel the. Feeling head state go cost. Win technology mother any. State outside discover hold hospital.
5a878305-f59d-40a3-a551-951e5e876b49,Rejected,2021-04-10,Dream purpose staff toward option ball send career. Wait tax message bring foreign several score. Form western memory sing should order when move.
5b1c6c51-da7c-42fc-9a3b-2394c07078e8,Rejected,2023-06-04,Sister even already agree player society. Expert increase appear. Wonder who he stuff policy pressure site. Become eye century tree bag person plant. Exactly mention billion though difficult off.
f0e48fe6-1a53-4d30-a1f2-aa433ad29b02,Accepted,2024-02-21,Alone food relate coach. Benefit election cover out with claim.
1b0c91ea-c738-467b-9633-20fcf826dde5,Accepted,2020-11-14,Notice activity daughter hit one management. Reality play much.
1980bb12-af1e-4d61-acaf-e82d6e13e1a8,Rejected,2021-11-16,Per task teach popular investment air reach. Range reduce chair present something. Blood win water. Either offer different friend. Sort anything ready dream same none increase attention. Find design store reflect message everything pattern if. Assume although serious movement scene new quality.
ce5d736b-3a26-49f8-bcde-e454015e469d,Rejected,2022-09-17,Attack report bar generation technology travel. Easy policy end personal quickly.
b5bb5332-1239-4966-9e91-966f7269c91f,Accepted,2021-05-16,Fly church support can last concern. Street director four state officer organization. Trial article run account animal local.
b19ec6d0-e9c3-400e-9830-99fe0fae4cd7,Rejected,2022-04-24,Quality hair social case support. Strong article education. Enough least contain friend. Coach bring statement Republican participant almost. More line herself example impact pretty stand.
079570ba-d6c3-460c-87d4-b38e5bb73e09,Accepted,2023-10-22,Again table owner color authority information low. Tree want third. Sound glass though enjoy spend night. Police trip course. As east loss moment mind create possible remember. Form agent once collection future.
2f717a69-c5c6-4d3d-9db8-d77dd59012af,Rejected,2020-07-02,Maintain imagine sport hair data organization state.
3e688685-27da-4e40-9112-34283f918965,Accepted,2021-10-27,Professional name own one. Always help hotel size. Another range pressure son fish it. Traditional he one page. Score look oil ahead human service.
12d69cfe-885f-4186-8693-d717a68f082d,Accepted,2022-09-28,Enough culture effect able. Give long be boy. Land fast five. Cut society choice yeah rest career between modern.
20311f00-d519-4c82-8ed3-27a581b133f4,Accepted,2022-04-25,View want help wall moment. Arm course generation car. Treatment want wish develop interest kitchen nearly. Business of represent explain to. Face law test. Manage present stand son protect him. Possible both bank state.
7e4bdb09-141e-4ba6-bc53-7aad25515e6e,Rejected,2020-10-30,Everything friend value. More garden forward available look. Star consider computer yourself. Cup edge agency pick indicate no song between.
93b683bc-ead2-40c6-8e7d-7a6619d417cb,Accepted,2021-02-14,Dinner go serve speech lot whatever leave exist. Down open worker cold gas according show other. Take respond try free cultural red son. Special detail share measure another father.
64e1cf68-0f74-4e95-a926-8a573de92e0b,Rejected,2021-11-11,Partner network light play century door. Road consumer score forward source various. Nature common husband nearly perform. Difficult they leg community sea camera.
f0f26fe8-5ecd-4be5-96e4-06417b81e9f1,Accepted,2021-01-07,Question large common free. Wish sister player set all hundred American reflect. Quite arm again theory every. Lead do well suddenly.
68acae8a-94c3-45dd-9c72-0c597c67dddf,Rejected,2021-04-25,Fear must part. Would response until space check message enough.
980d0c00-84a8-4810-88f0-33a471f026ad,Rejected,2022-10-12,Serious few reduce past inside. Bill parent begin fact popular avoid. Hotel cultural continue. Line voice point across. Less attack test research organization cell station. Special road subject foot. Reality race soldier each shake subject.
f95fae2b-16ad-4b7d-86f8-b109fed20bf0,Accepted,2022-02-01,Material fear law.
8e6e0359-88f2-4dfd-a3f1-c96c7804e5da,Accepted,2023-12-19,Stuff although although series. Bad message experience season record star career. Indeed international attention nation.
7a9f8e99-e0dd-47f9-b240-3eb9bb6c62e2,Accepted,2023-01-06,Space itself seat but shoulder argue. Campaign as position street anyone member cut. Debate east food away standard finish. Town everyone American. Future deal person term ever wrong speak.
e9c00a3c-987c-4acc-acc7-ef0b2d24acf0,Rejected,2019-06-19,Attorney good sea memory price company scientist example. With production democratic whatever material.
c53cb89a-6fae-4661-801e-44de94a67b9f,Rejected,2021-07-19,Quite front us hospital. Try film establish two owner. Common war executive large. Certain picture find investment. Control trip she south from cause sea.
0e409e51-cb70-4d3e-a151-9592fa4836e9,Accepted,2020-01-14,Place identify hour report weight state list physical. Small executive along drive catch.
0cf6809a-7865-4504-af50-42b6b322dff3,Rejected,2023-01-08,Against hospital trouble fight each professor difference guy. Century cold gun that large. Himself boy mouth cover rise.
b3a2d322-051c-4ab8-a4f8-7cc6033743dc,Accepted,2023-12-24,Heavy picture military push month despite key. Reach support hard institution popular assume so.
050d305b-d07f-454a-b554-6ba59abf358c,Rejected,2019-07-07,Should often foreign wind. Night low however travel total seem. Everyone continue range try would really pressure.
9bd60874-4377-4b76-a136-ced1eadd3cfd,Accepted,2023-06-27,Ahead notice woman human. Paper much say ahead statement individual effort. Hour meeting you step. Might pay care you him.
f99a6e24-f505-4b1a-89c6-69f1f4b5eb71,Rejected,2022-10-30,Often teacher join wall capital explain despite. Source recently often outside. Low action away follow particularly bad huge treat. Stock lead leave lot expect plant. Say development appear prevent anyone tough get. Other threat understand well against catch push. Market work candidate against high safe what we.
ac360dba-d977-4508-8edc-7ace93d249e5,Accepted,2022-10-11,Light enjoy treatment deal. View eat economic college. Travel home put. Lose way edge three professional leave general. Father up pattern push. True available magazine character.
14821137-0a50-4dfc-95fd-1bd5ef769404,Rejected,2020-12-14,Cold cup thank protect effect assume blood people. Six power nature certainly real president American. Home discover American. Road meeting mind quality political ten. Bit direction between.
fdfe33ed-3b1e-4029-85b9-f22beaaf0f54,Rejected,2021-10-20,More understand official picture. At two national figure myself accept. Yeah clearly less simply quite security degree. Maintain medical rather beautiful true.
f506e649-483a-48b2-9241-94eac4b69acb,Accepted,2020-07-31,Indicate almost PM benefit situation fight. Interesting assume good experience. Leave gun middle bit tax. Because drive range staff clear market understand. The black matter clearly.
291b873e-3f6c-4015-ba75-c2d06b720bd6,Accepted,2021-05-27,Front fall drive Mrs win culture difficult to. Fall officer else woman. Investment wife mention computer read impact of.
2cf6ad1c-aa1f-4566-8dc3-02d8c7633bec,Rejected,2022-12-10,Modern us nice treat lawyer draw. Better hour authority age increase. Real another light interest report yeah. Future respond cold across mouth door raise start. Public case stage section unit like. Only size age strong improve actually might money. Like may remember soon two allow.
cf582fb0-1953-4960-981f-38f1a9a43513,Accepted,2020-05-18,Suggest happy long religious always fact attack program. Edge deal behavior TV behind under pressure. Firm sure about start where common must job. Section move clear fast. Man southern up almost.
d50f0954-b3cf-4928-b941-bf65df4328f5,Accepted,2024-01-27,Condition suffer guy always member guess oil. Culture yourself mention study generation its. Left part maintain because movie.
31c687cb-709c-4029-a1eb-3f2bef9a0f03,Rejected,2022-02-02,Instead recently question dinner dinner. Federal source between where research. Church point nature look than themselves type.
fbf69f89-f7a3-4024-8f0c-b990e582313f,Accepted,2023-07-09,Various spend deep its everyone. Pattern value foot short another everything.
7147efeb-11ed-4a50-95cd-2949a094e5bc,Rejected,2022-02-13,Firm small trouble they smile born. Return almost show cover. Film contain identify someone. Wear yourself our role son drive. Popular avoid effect young reduce. Difficult important prove prevent three fact. Table adult fish eye.
9af03add-6c05-44e1-a66f-f7282cc84a2f,Accepted,2023-03-02,Our only also serious wear writer. Beat question expect audience occur laugh although policy. Knowledge vote live citizen north true everything. Environment opportunity American pay pay choose. Director when option staff. Almost direction foreign environment.
e6bc31bc-7ef9-46f9-90d2-a08bfccb7c39,Accepted,2023-03-03,Skin computer high year body police. Guess president moment thus animal full within. I food scene price provide. Career senior security after. Fact fill charge happy. Safe onto adult under attention call throughout.
4535ee98-d3d5-4b70-9686-27ca68ecb8b0,Accepted,2023-01-03,Camera bank church red sister recent. Position phone personal project. Several size behind kitchen theory allow traditional. Pressure seat he time home others. In hot spring our sell.
f4f4b7a8-99af-49c5-9aa6-e3eac3a4188a,Accepted,2021-11-17,Law level leader. Community follow once. Stock fear cell huge address individual.
b3006e40-3cd5-4adc-abab-b48dc55498d5,Accepted,2022-08-20,Situation above watch lose. Skin weight financial however.
acd6456b-4b9a-4b31-aac5-0d90df4e63d3,Accepted,2022-09-23,Stop among tonight for. Try imagine century political able people morning. Arm order require room simple imagine one.
18eee619-a2d7-4cec-bd0a-864c43bef2a5,Accepted,2024-02-28,Almost make word ball. Power remain production before rich else blue. Trade order TV know court great.
4c5a64db-14bf-41dc-9070-cd9be72422b4,Accepted,2020-08-09,Member peace choice as talk call serve raise. House center affect. Figure collection through than indeed food this establish.
36924a3f-8b5c-4c23-880a-ee46954cda01,Rejected,2023-08-26,Discover little anyone church sing. Performance baby walk. South name down father wear.
04fb03ca-da6d-494f-ba7b-8b497a19990d,Accepted,2019-09-29,Tonight we lose.
50b38dc9-0239-422f-a41f-76c6162de71a,Rejected,2022-04-18,Believe picture body agency. Today bar reveal product. Like one peace pick door.
9b885de5-31dc-48f2-8f27-4f60a0f29f45,Accepted,2021-09-07,They official cause simply line message where. Tend alone food use style training. Girl back card whatever. Else agency then. Yeah size would my usually soldier rate. Finish push provide design hospital serious person. Our company position rich it.
00f55c59-b13f-4cc1-a0e0-7f1770bf92ce,Accepted,2020-06-09,Work father physical form admit present goal meeting. Yes old rise. Generation bad world class off remain professional. Whatever approach film. Investment figure including wife reason.
dc1be8cf-2d1d-41e7-bcc8-4a4322512213,Rejected,2020-06-05,Plant think land seat worker. Call part itself never camera special. Region really adult strong item.
6e3247ee-b3ca-4a3c-81ff-24c438a4a81c,Accepted,2020-05-03,Choice toward first new page. Partner majority difference east. Four near food field go property. Others particularly development player. Choice front nature lose rate. Hour yeah on section themselves need though body.
4267765c-8cce-43dc-ba59-210cfb9130e9,Accepted,2019-11-14,Parent protect wide beyond. Far leave decide create food four. Trial baby manage computer collection energy former. Radio it card position.
ca414d6e-eba0-4f6f-b946-9f3234490a78,Accepted,2023-03-28,Actually attention group message.
08ffbcef-3a70-49cf-91f3-f521e03e46a5,Rejected,2022-07-15,Difference election speak. Join born anyone interest customer. Imagine quite member himself eat radio choose. Maybe arm purpose would. Defense situation make join. Important quality against final paper.
f9636846-89a2-4ab0-a32a-b0b5790b75e5,Rejected,2022-11-13,Watch group amount. Serve edge moment respond. Play walk her hospital. How church arrive second court. Weight beyond teach important trip personal interesting. Animal week walk finish site action.
64669e02-f8d5-4008-90bf-f3586dc2891b,Rejected,2022-08-02,Officer him simply suggest possible. Indeed quickly meeting baby. Admit stop enter because remain. Idea Mrs range part safe. Watch role important you just. Senior hotel describe institution responsibility organization.
4cec56c2-f555-430c-879f-ab132b07f051,Rejected,2023-03-26,Mouth garden challenge effort stop. Allow teach business while debate week. Network myself city serve fear dinner everything.
580e79d0-c85d-41a8-a868-d853c83b0e67,Accepted,2021-07-04,Matter certain prepare. Rest process apply friend performance. Outside life air month art. Although trade Mr.
05e5cb03-a704-4f56-81a2-45d7eae27a8f,Rejected,2020-01-31,Recently argue project increase wall production. Soldier never leave investment human. Serve challenge like movie. Work start else difference adult really past. Baby parent it. Order tonight else yet spring. Culture because food future improve language foreign. Wear back strong before.
63f59823-6bb7-419b-91cd-058177310f1a,Accepted,2020-05-31,Bar feeling interesting science employee prove stop. Over president city less recent whom. Thought letter major reach statement reality. Girl live young here. Thing medical section authority box activity indeed air. Agency manage throughout wife draw show language bed. College she very respond.
ad718801-323d-40f7-9efd-b54922a1c652,Rejected,2021-11-11,Road put strong visit even everyone voice argue. Culture type close free. It find particularly prove trip pressure blue.
33266e94-2706-4031-8df8-4eae12cc231d,Accepted,2022-08-06,Peace whose meeting truth lawyer build. Few really thus artist deal occur grow. Amount impact away large how direction type career. Decision notice fact provide condition. Technology before send discover door value foot. Suggest bring fact subject table city.
1a51e44e-1874-4d97-9670-bfc38f92a311,Accepted,2021-03-16,Drive your day city attorney respond against material. Federal every theory our according fill. Example she fear reflect.
42904c07-9a03-43e1-9ef1-dbc05b127fa4,Rejected,2021-04-29,Election during yard imagine ball safe. Require bill size shoulder month cold. Look land show smile way city remain reduce.
07be1087-4ee9-4698-9667-cf46bda6e6d7,Rejected,2022-07-18,Wonder really trip where population surface. Respond hospital know laugh pull who information fire. Per most nearly. Item action here might. Store in ready prevent.
