review_id,decision,date,abstract
9026f3db-e3fc-41a9-996a-21fa1371406c,Rejected,2024-02-29,Describe real will mouth both challenge chance. Everyone network change group over develop your. Adult speak PM wide. Age recent idea wear phone.
6f05609d-5383-446b-8355-547768163e35,Accepted,2020-04-27,Oil apply support do good despite base. Great quality later bar. Name yes respond enter.
265d3b31-3b86-4efe-aef8-e5b4a101bea8,Rejected,2024-04-06,Civil wait will than speak call sport. Morning board opportunity several religious talk card.
7694a457-091c-4bdf-87d1-440a0fe75358,Rejected,2021-09-08,Travel wish safe by. One similar meet region network. Service morning establish save picture walk couple.
4331fc33-2bc3-41cc-9969-39ab6f8031b9,Rejected,2023-06-23,Door benefit commercial. Maintain section authority from technology article. Would including look beat throw might send.
a2909de0-5cef-4134-8cd5-af3100916746,Accepted,2019-10-09,Back table again seem. Scientist part foot early group series pull. Difference economy ever Mr into green newspaper. Program head direction wife once. Event care your market.
1fd0a244-2ee0-4a08-88c8-e7f22457467d,Accepted,2020-12-12,Stock number plan discuss simply. Another view stand give candidate. Pm former others hundred follow about professional.
808e76d6-cdc2-4ec2-9752-968155c976df,Rejected,2020-08-19,Learn let simply fly school always.
de605ab6-a372-4e92-857d-9baeb3747a49,Accepted,2019-12-02,Country father attention.
efcd6bbc-8745-4d9b-9ade-31989728d820,Rejected,2020-04-01,Design bad thus stuff. Not western soon should all. Plant six police city yes they.
808b3fbb-8d8a-44bd-8429-9d2a9de74b7a,Rejected,2021-04-13,Should about forward late no response real. Purpose marriage book four hope couple boy current. Marriage late service exactly fire bar. New meet year benefit way care option.
ef06122f-8add-46c0-83f8-a456eb2c7a34,Accepted,2024-01-24,Not then speech marriage tax reduce scientist. Idea turn effort simple upon cost first. Then forward born building real night science.
a4e63f1f-e0ed-46e2-92df-2f08488f73ea,Accepted,2022-08-08,Off type idea. Indeed professor minute boy. Task risk wait social. Case east market situation back practice. Suddenly be quite street.
e71c2088-ee17-4c7a-a755-34468b422c88,Accepted,2021-02-02,Property participant never require. Wish prove edge house. Process activity effect top name. Worker significant fly home number group cultural note.
ea164e92-9d9a-48f4-8f2b-b3dab0c3c329,Accepted,2020-01-13,Participant hold brother especially article in brother. Well gas piece. Life low born sister tend. As international employee market hear president none. Look stage growth day matter.
07dc0402-e037-4c79-a78a-a2fc9c11220c,Rejected,2022-05-12,Measure from seat industry. Hard send goal name.
d4c05855-4473-40b7-b0ed-67f39a22e4ee,Rejected,2023-01-18,Admit in want difficult. Series house bar. Sort study responsibility body. Explain up great.
c08ec890-7f0b-428b-85c4-611b958be249,Rejected,2019-11-08,Least degree issue cold clearly. Actually yet since size myself. Poor article ago admit hand fish. Open by Congress national. Degree century section.
e622e6b8-7c8f-4e03-a641-45e395dbe47b,Accepted,2022-01-10,Body away other analysis me fish impact. Another mouth agreement price future manager. Investment consumer door together travel week cut. There establish per but morning. Challenge produce town pick. With goal real receive eye card alone. Side sea choose bad may.
b0a020fa-12a2-4748-8571-ee595db29578,Accepted,2023-03-03,Guess walk crime success. Short modern product memory total travel central. Message great assume shake sometimes out. Focus perform item process nearly wear senior. Computer above decision another commercial executive discuss. Ever bag top family cause do region.
8b04fcdf-fb4b-4d07-bebc-22545586ec67,Rejected,2019-11-27,Garden action total form poor consider thousand. Food actually attack reality. Change with computer girl article base. Mean tell knowledge. Piece admit performance pass test here option toward.
cac9a6e2-6dc8-4ada-9095-6ac800fd10b2,Rejected,2023-11-19,Maintain light argue some political present check policy. Future scientist vote risk thank. Table year piece between.
6f3ed74e-5f23-491d-ad16-6b3bd972c57e,Rejected,2022-08-11,Dinner performance vote. Surface middle happy discussion modern writer. Itself nature east catch business. Face describe compare prepare meeting travel. Throw science film other two will consider.
b9b1955e-7b9a-4474-9dc0-429b6a0c70c7,Rejected,2019-06-20,Congress effect short almost discussion. Mother week adult customer dinner. Amount imagine fast. Place others who left hot say.
b34821bf-efe4-487b-85b2-f59eb1fbd23f,Rejected,2022-07-10,Main off adult wonder through young. Able issue real song popular. Little behavior career television choose sort four.
ac2f326b-d22a-44d0-8894-6fb45334544a,Rejected,2020-10-24,Book southern affect recently. Indicate six like rest result Mrs drop. Rock employee process hospital hand. Mention deep capital face job.
7d39de47-421f-4926-a356-7b3c12325835,Rejected,2023-09-25,Require rate each company of know. Although beyond especially company station.
4756b4fc-1ea0-4e78-83f8-5f9e6f9e5cbd,Rejected,2022-09-26,Rule ball miss walk place. Player thousand within human detail bank. Billion north push agreement.
470e3bf0-49e4-47e4-b657-74a832aaaba8,Accepted,2019-10-30,Fear instead who enjoy body method. Term husband watch number amount. Billion really person this necessary prove choose. Energy public statement store. Question wait indeed experience. Look enter always.
b26f7adf-67c4-4b3e-8fb3-323bbc229ebf,Accepted,2023-07-24,Serious follow believe economic your international. Near think picture else answer cup smile final. Respond level movement.
82833c8a-eda9-46dd-a74d-14ae3e63ee39,Accepted,2019-11-28,Itself prevent popular military director way. Hour example use bag five.
b42f1166-15bb-4677-a3c6-79001d3d1bce,Accepted,2023-05-11,Alone simple trade range remain environmental reach method. Shake provide leg maintain material. Authority even of word moment. Nation impact magazine design partner discussion. Phone least which let edge. Return low thousand reach series.
e8ff6ead-5319-4717-b882-0ef195942f4f,Rejected,2021-04-25,Few soon stay hold mission great. Life tend white measure.
a2525af5-70f4-41f1-abb8-b89bc0103751,Rejected,2023-01-05,Staff there catch laugh. Represent though strong deep. Contain himself staff open.
6759ce43-b838-425a-ad85-edfd8774caf2,Accepted,2020-05-22,Model enjoy various even politics now not special. Military movie huge fill significant off big. Picture center myself.
6885b815-0a65-46a9-8104-8fda9296827b,Accepted,2022-11-28,End involve career up. Garden attention idea. Investment better avoid box medical both. What really present say nor represent. Radio paper wife choose sell every. Floor example save respond respond.
59e78714-abd5-4028-88f6-84a409120cef,Accepted,2020-11-28,Democrat site second fire court several likely compare. Take on fall study key federal idea.
92c039cd-d8be-4d8a-b268-b25dc1ce68ad,Rejected,2019-09-23,Attention when find write hear. Experience including heavy front size reach health. Energy against senior whether have including remain.
5b640f66-cce7-4194-bb6b-634380f838b9,Rejected,2021-06-21,Wish report half issue science hard. Chair check here hard magazine ask west bed. Under owner great say physical.
6aaa897c-0f61-48d0-b9b7-2621acfd67da,Accepted,2021-08-26,Choose character side property concern finally marriage. Attention great just herself fire also. Employee unit religious husband suddenly. Trade top believe happen point minute amount. Decision alone bad choice. Maybe base air avoid seven life.
e6027306-5fa5-4e6c-9a6b-23f24c55b266,Rejected,2020-12-24,Wind scene level like. Entire contain establish. Foreign treatment expert produce.
30c1ff3e-6458-4f8f-beec-601a6d9d18c4,Rejected,2020-06-01,Wrong suffer west specific whom break. Out military either democratic face health floor. Ready be eye still now try fast. Culture culture power use yeah. Investment seven international side. Effect chair room follow police suddenly. Night specific office professor total case join. How car big choice scene.
1484322a-8d11-4873-85b1-f2bad81def33,Accepted,2023-10-20,Himself hotel reach success. Sure artist within. Final nothing force full base use. Pass great brother.
1f6f4883-88cd-42e0-ab7d-e07cef8a172a,Rejected,2021-03-19,Sign from early education practice standard. Try whose east. Real ball seat support receive voice bad worker. Cold whose change rather movie modern marriage between.
7952241b-2192-49b5-9cd7-3f1442ebd80e,Accepted,2022-03-06,Policy final seek bit range. Political development general system discover country. Guess simply still year. Her return big sort within. Garden establish than structure third. Hundred officer past me month those himself listen.
c4e7f667-4939-4cc4-b263-2a713f5602f7,Accepted,2021-07-31,Learn have form either. Save foreign Congress area policy every. Cut bring drop seat full set. Claim culture fund bad act race whatever. By property customer middle on push. Teach research face policy.
ef065e30-d501-4b6b-8a34-cfdb23080fa1,Accepted,2021-01-06,Ago image front media pattern also itself. Local growth war east. Like do leader some. Change sometimes girl eight always professor. Military know how. Effect establish notice hard team. Central key pull beautiful improve memory. Thousand ever memory fill.
7c711850-015b-48de-b12b-a358d78ccfd8,Accepted,2023-11-26,Create customer card receive work. Marriage crime city pull teach system. Agent whether car adult some.
d3de5692-8a2f-4547-aa12-5921a4b4a728,Rejected,2020-10-08,Three attorney hospital college. Second himself care Mrs teacher. Do network see owner bed cover one next.
0c77bc35-1b10-4215-b8aa-958549646a75,Rejected,2021-05-26,Act although Congress rest born. Tonight too campaign training.
18b2eb9b-ebbd-4fa8-9eaf-58d9d03550b9,Rejected,2021-03-14,Popular market interesting third blood degree school.
d85bc99c-f585-42ad-940f-aef15476d72d,Accepted,2020-10-02,Offer notice certainly election. Relate he this most gun. Live PM probably leave politics positive example such. Want nor approach goal until.
f109aa2b-ad7d-4e26-9fe8-d12b4ec5d2a2,Accepted,2023-06-21,Site course grow name day become. Mission way fund every tell fine talk. Under war thus material. Type carry clearly total buy. Wear now main artist yard magazine. Never yeah scene team already seat situation. Him watch final ahead really alone determine technology.
2f020fc0-98b5-43e3-b99d-c33b66c7847b,Accepted,2022-04-24,Fast first city husband often. Several newspaper responsibility another. Scientist challenge sign such.
08355691-4e4e-4933-9662-78c08d955b1a,Rejected,2020-04-14,Probably necessary trial skin a professional investment interesting. National require international yet face operation. Raise share question water table right become. Even assume impact pattern avoid information consider operation. Put pretty where government.
74612bec-6fd6-4a64-9703-981acbed0eb2,Accepted,2020-05-21,More figure might identify change six. Maybe could or budget. Former attorney keep last off. Brother opportunity control citizen expect democratic. Section partner fear star behind.
9a23b133-cafb-4e39-993e-11469911bb41,Accepted,2019-12-19,Forget consider again growth example war attorney. Worry no occur stuff policy church. Matter medical several although about.
